{
  "item_id": "silver.selectintotarget",
  "status": "ok",
  "coverage": "complete",
  "branch_manifest": [
    {
      "id": "rows_present_full_refresh",
      "statement_index": 0,
      "description": "bronze.Product has rows — SELECT INTO populates silver.SelectIntoTarget with CAST(ProductID) and ProductName",
      "scenarios": ["test_selectinto_rows_present_populates_target"]
    },
    {
      "id": "empty_source_no_rows_inserted",
      "statement_index": 0,
      "description": "bronze.Product is empty — SELECT INTO produces no rows in silver.SelectIntoTarget",
      "scenarios": ["test_selectinto_empty_source_no_rows"]
    }
  ],
  "unit_tests": [
    {
      "name": "test_selectinto_rows_present_populates_target",
      "target_table": "[silver].[SelectIntoTarget]",
      "procedure": "[silver].[usp_load_SelectIntoTarget]",
      "given": [
        {
          "table": "[bronze].[Product]",
          "rows": [
            {
              "ProductName": "Mountain Bike",
              "ProductNumber": "MB-001",
              "MakeFlag": 1,
              "FinishedGoodsFlag": 1,
              "SafetyStockLevel": 100,
              "ReorderPoint": 50,
              "StandardCost": 200.00,
              "ListPrice": 499.99,
              "DaysToManufacture": 4,
              "SellStartDate": "2020-01-01",
              "ModifiedDate": "2023-06-01"
            }
          ]
        }
      ]
    },
    {
      "name": "test_selectinto_empty_source_no_rows",
      "target_table": "[silver].[SelectIntoTarget]",
      "procedure": "[silver].[usp_load_SelectIntoTarget]",
      "given": [
        {
          "table": "[bronze].[Product]",
          "rows": []
        }
      ]
    }
  ],
  "uncovered_branches": [],
  "warnings": [],
  "validation": {
    "passed": true,
    "issues": []
  },
  "errors": []
}
