{
  "item_id": "silver.updatejointarget",
  "status": "ok",
  "coverage": "complete",
  "branch_manifest": [
    {
      "id": "update_matched_rows",
      "statement_index": 0,
      "description": "UPDATE sets EnglishProductName and LastSeenDate for rows matched via INNER JOIN on ProductAlternateKey",
      "scenarios": [
        "test_update_matched_row"
      ]
    },
    {
      "id": "join_miss_no_update",
      "statement_index": 0,
      "description": "Target rows with no matching source row are left unchanged (INNER JOIN miss)",
      "scenarios": [
        "test_join_miss_row_unchanged"
      ]
    },
    {
      "id": "null_join_key",
      "statement_index": 0,
      "description": "NULL ProductAlternateKey in target never matches source, row unchanged",
      "scenarios": []
    }
  ],
  "unit_tests": [
    {
      "name": "test_update_matched_row",
      "model": "updatejointarget",
      "given": [
        {
          "rows": [
            {
              "ProductAlternateKey": "1",
              "EnglishProductName": "Road-150",
              "LastSeenDate": "2024-01-01T00:00:00"
            }
          ],
          "table": "[silver].[UpdateJoinTarget]"
        },
        {
          "rows": [
            {
              "ProductID": 1,
              "ProductName": "Road-150-Updated",
              "ProductNumber": "AR-5381",
              "MakeFlag": 1,
              "FinishedGoodsFlag": 1,
              "SafetyStockLevel": 500,
              "ReorderPoint": 375,
              "StandardCost": 10.0,
              "ListPrice": 25.0,
              "DaysToManufacture": 1,
              "SellStartDate": "2024-01-01T00:00:00",
              "ModifiedDate": "2024-01-01T00:00:00"
            }
          ],
          "table": "[bronze].[Product]"
        }
      ],
      "expect": {
        "rows": [
          {
            "ProductAlternateKey": "1",
            "EnglishProductName": "Road-150-Updated"
          }
        ]
      },
      "target_table": "[silver].[UpdateJoinTarget]",
      "procedure": "[silver].[usp_load_UpdateJoinTarget]"
    },
    {
      "name": "test_join_miss_row_unchanged",
      "model": "updatejointarget",
      "given": [
        {
          "rows": [
            {
              "ProductAlternateKey": "999",
              "EnglishProductName": "Obsolete Product",
              "LastSeenDate": "2024-01-01T00:00:00"
            }
          ],
          "table": "[silver].[UpdateJoinTarget]"
        },
        {
          "rows": [
            {
              "ProductID": 1,
              "ProductName": "Road-150",
              "ProductNumber": "AR-5381",
              "MakeFlag": 1,
              "FinishedGoodsFlag": 1,
              "SafetyStockLevel": 500,
              "ReorderPoint": 375,
              "StandardCost": 10.0,
              "ListPrice": 25.0,
              "DaysToManufacture": 1,
              "SellStartDate": "2024-01-01T00:00:00",
              "ModifiedDate": "2024-01-01T00:00:00"
            }
          ],
          "table": "[bronze].[Product]"
        }
      ],
      "target_table": "[silver].[UpdateJoinTarget]",
      "procedure": "[silver].[usp_load_UpdateJoinTarget]"
    }
  ],
  "uncovered_branches": [],
  "warnings": [
    {
      "code": "FIXTURE_QUALITY_WARNING",
      "message": "Branch null_join_key is untestable: ProductAlternateKey is declared NOT NULL in silver.UpdateJoinTarget; a NULL target key value cannot be inserted via static fixtures.",
      "item_id": "silver.updatejointarget",
      "severity": "warning",
      "details": {}
    }
  ],
  "validation": {
    "passed": true,
    "issues": []
  },
  "errors": []
}
