{
  "item_id": "silver.updatejointarget",
  "status": "ok",
  "coverage": "complete",
  "branch_manifest": [
    {
      "id": "update_matched_rows",
      "statement_index": 0,
      "description": "UPDATE sets EnglishProductName and LastSeenDate for rows matched via INNER JOIN on ProductAlternateKey",
      "scenarios": [
        "test_update_matched_row"
      ]
    },
    {
      "id": "join_miss_no_update",
      "statement_index": 0,
      "description": "Target rows with no matching source row are left unchanged (INNER JOIN miss)",
      "scenarios": [
        "test_update_join_miss_no_update"
      ]
    },
    {
      "id": "null_join_key",
      "statement_index": 0,
      "description": "NULL ProductAlternateKey in target never matches source, row unchanged",
      "scenarios": [
        "test_update_null_join_key"
      ]
    }
  ],
  "unit_tests": [
    {
      "name": "test_update_matched_row",
      "model": "stg_updatejointarget",
      "given": [
        {
          "rows": [
            {
              "ProductID": 1,
              "ProductName": "Road-150-Updated"
            }
          ],
          "table": "[bronze].[Product]"
        },
        {
          "rows": [
            {
              "ProductAlternateKey": "1",
              "EnglishProductName": "Road-150",
              "LastSeenDate": "2024-01-01T00:00:00Z"
            }
          ],
          "table": "[silver].[UpdateJoinTarget]"
        }
      ],
      "target_table": "[silver].[UpdateJoinTarget]",
      "procedure": "[silver].[usp_load_UpdateJoinTarget]"
    },
    {
      "name": "test_update_join_miss_no_update",
      "model": "stg_updatejointarget",
      "given": [
        {
          "rows": [
            {
              "ProductID": 100,
              "ProductName": "New-Product"
            }
          ],
          "table": "[bronze].[Product]"
        },
        {
          "rows": [
            {
              "ProductAlternateKey": "99",
              "EnglishProductName": "Old-Product",
              "LastSeenDate": "2024-01-01T00:00:00Z"
            }
          ],
          "table": "[silver].[UpdateJoinTarget]"
        }
      ],
      "target_table": "[silver].[UpdateJoinTarget]",
      "procedure": "[silver].[usp_load_UpdateJoinTarget]"
    },
    {
      "name": "test_update_null_join_key",
      "model": "stg_updatejointarget",
      "given": [
        {
          "rows": [
            {
              "ProductID": 1,
              "ProductName": "Road-150-Updated"
            }
          ],
          "table": "[bronze].[Product]"
        },
        {
          "rows": [
            {
              "ProductAlternateKey": null,
              "EnglishProductName": "Unknown-Product",
              "LastSeenDate": "2024-01-01T00:00:00Z"
            }
          ],
          "table": "[silver].[UpdateJoinTarget]"
        }
      ],
      "target_table": "[silver].[UpdateJoinTarget]",
      "procedure": "[silver].[usp_load_UpdateJoinTarget]"
    }
  ],
  "uncovered_branches": [],
  "warnings": [],
  "validation": {
    "passed": true,
    "issues": []
  },
  "errors": []
}